{
  "$schema":"https://json-schema.org/draft/2020-12/schema","$id":"conformance-state-contract/v1","title":"Architecture Conformance consumer state contract v1","type":"object","additionalProperties":false,"required":["version","stateVersion","identity","checkpoint","paths","evidence","freshness"],
  "properties":{"version":{"const":"conformance-state-contract/v1"},"stateVersion":{"const":"onboarding-state/v1"},"identity":{"type":"string","minLength":1},"checkpoint":{"enum":["scope-selected","evidence-generated","classification-drafted","proposed-contract-checked","active-contract-checked","baseline-created"]},"paths":{"$ref":"#/$defs/paths"},"evidence":{"type":"object","additionalProperties":false,"patternProperties":{"^(graph|summary|map|contract|report|baseline)$":{"type":"string","minLength":1}}},"freshness":{"$ref":"#/$defs/freshness"}},
  "$defs":{"nonEmpty":{"type":"string","minLength":1},"paths":{"type":"object","additionalProperties":false,"required":["state","graph","summary","map","contract","report","baseline"],"properties":{"state":{"$ref":"#/$defs/nonEmpty"},"graph":{"$ref":"#/$defs/nonEmpty"},"summary":{"$ref":"#/$defs/nonEmpty"},"map":{"$ref":"#/$defs/nonEmpty"},"contract":{"$ref":"#/$defs/nonEmpty"},"report":{"$ref":"#/$defs/nonEmpty"},"baseline":{"$ref":"#/$defs/nonEmpty"}}},"freshness":{"type":"object","additionalProperties":false,"required":["status","inputs","reason"],"properties":{"status":{"enum":["fresh","stale","unavailable","unknown"]},"inputs":{"type":"array","items":{"type":"object","additionalProperties":false,"required":["kind","path","digest"],"properties":{"kind":{"$ref":"#/$defs/nonEmpty"},"path":{"$ref":"#/$defs/nonEmpty"},"digest":{"$ref":"#/$defs/nonEmpty"}}}},"reason":{"$ref":"#/$defs/nonEmpty"}}}}
}
