{"version":"conformance-state-contract/v1","stateVersion":"onboarding-state/v1","identity":"state-007","checkpoint":"evidence-generated","paths":{"state":"state","graph":"graph","summary":"summary","map":"map","contract":"contract","report":"report","baseline":"baseline"},"evidence":{"graph":"sha256-graph","summary":"sha256-summary"},"freshness":{"status":"unknown","inputs":[{"kind":"source","path":"src/index.ts","digest":"sha256-source"}],"reason":"The source owner has not confirmed the input identity."}}
