{"version":"conformance-state-contract/v1","stateVersion":"onboarding-state/v1","identity":"state-005","checkpoint":"active-contract-checked","paths":{"state":"state","graph":"graph","summary":"summary","map":"map","contract":"contract","report":"report","baseline":"baseline"},"evidence":{"graph":"old-graph","summary":"old-summary","map":"map","contract":"contract","report":"old-report"},"freshness":{"status":"stale","inputs":[{"kind":"source","path":"src/index.ts","digest":"new-source"}],"reason":"The source digest no longer matches the recorded graph."}}
